{
  "$schema": "http://json-schema.org/draft-07/schema#",
  "$id": "https://github.com/UtkristaUwa/CITS3200_57/ingestion/tender.schema.json",
  "title": "TenderAI tender record",
  "description": "Shape a teammate formats a scraped tender into before submitting it with validate_and_submit.py. This is the SAME shape that gets stored in BigQuery's `tenders` table, minus the bookkeeping fields (tender_id, content_hash, first_seen_at, last_scanned_at, updated_at) which are computed by upsert_tender() and must never be set by hand.",
  "type": "object",
  "additionalProperties": false,
  "required": ["source_id", "source_url", "title"],
  "properties": {
    "source_reference_id": {
      "type": ["string", "null"],
      "description": "The portal's own ID/code for this tender (e.g. an RFx number). Used together with source_id to detect whether this is a new tender or an update to one already stored. If a source has no stable reference ID, leave this null and source_url is used instead."
    },
    "source_id": {
      "type": "string",
      "minLength": 1,
      "description": "Which portal this came from, matching a row in the `sources` table (e.g. \"vic-buyingfor\")."
    },
    "source_url": {
      "type": "string",
      "format": "uri",
      "description": "Direct link back to the tender's listing/detail page."
    },
    "title": { "type": "string", "minLength": 1 },
    "issuing_agency": { "type": ["string", "null"] },
    "category": {
      "type": ["string", "null"],
      "enum": ["tender", "rfq", "eoi", "grant", null]
    },
    "status": {
      "type": ["string", "null"],
      "enum": ["open", "closed", "awarded", "unknown", null]
    },
    "publish_date": {
      "type": ["string", "null"],
      "pattern": "^\\d{4}-\\d{2}-\\d{2}$",
      "description": "ISO date, e.g. \"2026-08-01\"."
    },
    "closing_date": {
      "type": ["string", "null"],
      "pattern": "^\\d{4}-\\d{2}-\\d{2}$"
    },
    "value_amount": { "type": ["number", "null"] },
    "value_currency": { "type": ["string", "null"] },
    "value_notes": { "type": ["string", "null"] },
    "location": {
      "type": ["string", "null"],
      "description": "Where the work happens, verbatim from the source — anything from a state abbreviation to a street address. Display field; filter on location_state instead."
    },
    "location_state": {
      "type": ["string", "null"],
      "enum": ["WA", "NSW", "VIC", "QLD", "SA", "TAS", "ACT", "NT", "NATIONAL", "MULTI", null],
      "description": "Filterable form of location. Resolved by the pipeline from the location's postcode where there is one; null when the source doesn't support an answer, which is deliberate — a guessed state hides the tender behind the wrong filter."
    },
    "description": {
      "type": ["string", "null"],
      "description": "Plain text only — no HTML/markdown."
    },
    "focus_areas": {
      "type": ["object", "null"],
      "description": "Relevance layer, set by processing/relevance_determination.py — never by hand. Maps a focus area tag_id from tender_processor.cfg to how central it is to the opportunity (1-5).",
      "additionalProperties": { "type": "integer", "minimum": 1, "maximum": 5 }
    },
    "work_types": {
      "type": ["object", "null"],
      "description": "As focus_areas, but for the work type tag_ids — what is actually being bought.",
      "additionalProperties": { "type": "integer", "minimum": 1, "maximum": 5 }
    },
    "fit": {
      "type": ["integer", "null"],
      "minimum": 0,
      "maximum": 100,
      "description": "Overall fit score derived from the focus_areas/work_types scores and the tender's recency. Near 0 when the main deliverable is out of scope."
    },
    "fit_reason": {
      "type": ["string", "null"],
      "description": "1-2 sentences pointing to the text that drove the fit decision."
    },
    "contact_name": { "type": ["string", "null"] },
    "contact_email": { "type": ["string", "null"] },
    "contact_phone": { "type": ["string", "null"] },
    "lodgment_address": { "type": ["string", "null"] },
    "documents": {
      "type": "array",
      "default": [],
      "description": "Plain-text-extracted attachments. No original file is archived (see schema doc design principles) — extracted_text is the only copy that survives.",
      "items": {
        "type": "object",
        "additionalProperties": false,
        "required": ["file_name"],
        "properties": {
          "document_id": {
            "type": ["string", "null"],
            "description": "Leave null — assigned automatically if omitted."
          },
          "file_name": { "type": "string", "minLength": 1 },
          "file_type": { "type": ["string", "null"], "enum": ["pdf", "docx", "rtf", "other", null] },
          "extracted_text": { "type": ["string", "null"] },
          "parsed_at": {
            "type": ["string", "null"],
            "description": "ISO timestamp. Leave null to default to submit time."
          },
          "storage_uri": {
            "type": ["string", "null"],
            "description": "GCS URI set by attachment_store.upload_tender_attachments(). Never set by hand — the pipeline fills this in."
          }
        }
      }
    },
    "raw_extra": {
      "type": ["object", "null"],
      "description": "Catch-all for source-specific fields not modelled above. Keep it JSON-serialisable."
    }
  }
}
